Patient_Problem,Disease,Prescription
I've been getting severe muscle cramps and spasms without exertion.,Electrolyte Imbalance,Electrolyte solutions; monitor intake and output.
I have a persistent dry cough and a fever for the past few days.,Pneumonia,Antibiotics; rest and fluids.
I'm experiencing frequent headaches and blurred vision.,Hypertension,Blood pressure medication; lifestyle changes.
"My memory seems to be getting worse, and I'm forgetting common things.",Alzheimer's Disease,Cholinesterase inhibitors; supportive care.
I have sudden episodes of dizziness and feel like the room is spinning.,Vertigo,Epley maneuver; avoid sudden head movements.
I'm seeing flashes of light and floating spots in my vision.,Retinal Detachment,Surgery; avoid straining eyes.
I have intense itching all over my body without a rash.,Liver Disease,Antihistamines; moisturizers for skin care.
"My skin is very dry and cracked, especially on my hands and feet.",Eczema,Topical steroids; keep skin moisturized.
I've been having panic attacks and feel anxious most of the time.,Generalized Anxiety Disorder,Cognitive Behavioral Therapy; SSRIs.
I notice a ringing in my ears that doesn't go away.,Tinnitus,Sound therapy; avoid loud noises.
I've experienced a loss of appetite and don't enjoy food anymore.,Depression,Antidepressants; eating nutrient-rich foods.
I get short of breath doing simple activities that I used to do easily.,Chronic Obstructive Pulmonary Disease,Bronchodilators; pulmonary rehabilitation.
I have unexplained bruising and bleeding that takes a long time to stop.,Leukemia,Chemotherapy; blood transfusions.
"I've been feeling extremely tired lately, regardless of how much I sleep.",Chronic Fatigue Syndrome,Gradual increase in daily physical activity; CBT for fatigue management.
"Experiencing sharp chest pains occasionally, especially under stress.",Angina Pectoris,Nitroglycerin as needed; stress reduction techniques.
Noticed a lump on my neck that has been growing.,Thyroid Cancer,Thyroidectomy followed by radioactive iodine therapy.
Sudden severe headache unlike any I've experienced before.,Subarachnoid Hemorrhage,Urgent medical evaluation; possible surgical intervention.
"Periods of intense heart palpitations, even at rest.",Atrial Fibrillation,Beta-blockers or antiarrhythmic drugs; lifestyle modifications.
Excessive sweating at night without any apparent reason.,Tuberculosis,Antibiotics; ensure good ventilation and sunlight exposure.
Blurry vision that's progressively getting worse.,Diabetic Retinopathy,Blood sugar control; possible laser treatment for eye.
Persistent indigestion and discomfort after eating.,Gastroesophageal Reflux Disease (GERD),Antacids and dietary adjustments; avoid lying down after eating.
A mole on my skin that has changed color and size.,Malignant Melanoma,Excision biopsy; regular skin checks; sunscreen use.
Frequent memory lapses and difficulty concentrating.,Early Onset Dementia,Cognitive-enhancing medications; support groups for dementia.
Uncontrollable tremors in my hands and fingers.,Parkinson's Disease,Levodopa and carbidopa; physical therapy.
Severe back pain that worsens when bending or lifting.,Herniated Disc,Pain relievers and physical therapy; surgery in severe cases.
Unexplained weight gain and facial puffiness.,Cushing's Syndrome,Reduction in corticosteroid use; tumor removal if applicable.
"Constant thirst and dry mouth, drinking more water than usual.",Diabetes Insipidus,Low-salt diet; medication to reduce urine output.
Loss of smell and taste that's persisted for weeks.,COVID-19,Rest and hydration; hospitalization if severe symptoms occur.
Recurrent episodes of fainting or dizziness.,Vasovagal Syncope,Avoid triggers; supervised tilt-table test for diagnosis.
Chronic diarrhea and abdominal cramps.,Irritable Bowel Syndrome (IBS),Dietary changes; antispasmodic medications.
Severe acne outbreak that's not responding to over-the-counter treatments.,Cystic Acne,Oral antibiotics; retinoid therapy; dermatologist consultation.
Waking up gasping for air during the night.,Sleep Apnea,CPAP machine at night; weight loss and exercise.
"Joint stiffness and pain, especially in the mornings.",Rheumatoid Arthritis,DMARDs; NSAIDs; physical therapy.
Experiencing sudden weight loss and loss of appetite.,Hyperthyroidism,Dietary iodine; consider thyroid hormone replacement therapy.
"My skin is dry, and I have constant itchiness without any visible rash.",Iron Deficiency Anemia,Iron supplements; increase intake of iron-rich foods.
"Feeling shortness of breath with mild exertion, and it seems to worsen.",Heart Failure,Diuretics; restrict salt intake; monitor weight and fluid intake.
"I have noticed swelling in my ankles and feet, which worsens throughout the day.",Venous Insufficiency,Compression stockings; elevate legs; avoid long periods of standing.
Experiencing memory lapses and difficulty concentrating on daily tasks.,Alzheimer's Disease,Cholinesterase inhibitors; ensure a safe environment; supportive care.
"I've developed sensitivity to cold temperatures, feeling cold all the time.",Hypothyroidism,Thyroid hormone replacement therapy; regular TSH level monitoring.
"My throat feels sore all the time, and I've lost my voice.",Laryngitis,Voice rest; hydration; humidified air; consider antibiotics if bacterial.
I'm experiencing chest pain that intensifies when I take a deep breath.,Pleurisy,NSAIDs for pain; rest; consult a doctor if symptoms worsen.
I have a high fever that's been persistent for more than three days.,Influenza,Antipyretics; rest; increased fluid intake; consult a doctor if symptoms persist.
"I've noticed blood in my stool, which is concerning.",Colorectal Cancer,Immediate medical evaluation; may involve colonoscopy and further testing.
"I have been feeling very tired lately, even with full sleep.",Chronic Fatigue Syndrome,Gradual exercise and sleep hygiene improvement.
"I've been having trouble sleeping, feeling anxious at night.",Insomnia,Maintain a regular sleep schedule and consider mild sedatives.
I feel constant heartburn and acid reflux.,GERD,Antacids and avoid spicy foods.
I've experienced sudden and unexplained weight gain.,Hypothyroidism,Levothyroxine daily.
I have severe and persistent abdominal pain.,Appendicitis,Surgical consultation if severe.
I notice my skin is yellowing.,Jaundice,Liver function tests and avoid alcohol.
"I'm facing difficulty swallowing, even liquids.",Esophageal Stricture,Liquids diet and esophageal dilation as needed.
I've lost my sense of smell and taste recently.,COVID-19,Isolation and test for COVID-19.
My hands and feet are often numb or tingling.,Peripheral Neuropathy,Vitamin B12 supplements and consider diabetes screening.
I'm having severe mood swings and feeling depressed.,Bipolar Disorder,Mood stabilizers and therapy.
I've observed a lump on my neck that's growing.,Thyroid Nodule,Ultrasound-guided fine-needle aspiration biopsy.
I'm experiencing chest pains and tightness.,Angina,"Consult cardiologist, avoid strenuous activity."
I've noticed a spreading rash on my arm that's very itchy.,Contact Dermatitis,Hydrocortisone cream; avoid irritant substances.
"Persistent coughing and shortness of breath, especially at night.",Chronic Asthma,"Fluticasone inhaler daily, Salbutamol as needed."
Experiencing sharp knee pain when walking or climbing stairs.,Knee Osteoarthritis,Physiotherapy; Acetaminophen for pain relief.
"My vision has become blurry, particularly when reading.",Age-related Macular Degeneration,Regular eye exams; consider anti-VEGF therapy.
"Feeling very tired lately, even after a full night's sleep.",Chronic Fatigue Syndrome,"Pacing activities, cognitive behavioral therapy."
Frequent urination and excessive thirst have been a problem.,Type 1 Diabetes,Insulin therapy as prescribed; monitor blood glucose levels.
"Trouble sleeping, feeling anxious and restless at nights.",Insomnia and Anxiety,"Sleep hygiene practices; if needed, low-dose anti-anxiety medication."
Sudden weight loss and lack of appetite for no clear reason.,Unexplained Weight Loss,Comprehensive metabolic panel; consult for further endocrine evaluation.
"Swelling and pain in the joints, particularly in the mornings.",Rheumatoid Arthritis,Methotrexate as prescribed; physical therapy.
Excessive sweating at night without any physical exertion.,Tuberculosis,Antituberculosis therapy as per guidelines.
A persistent dry cough that has lasted for more than a month.,Chronic Bronchitis,Stop smoking; consider inhaled corticosteroids.
"Constant feeling of being cold, even in warm temperatures.",Hypothyroidism,Levothyroxine as prescribed; regular TSH levels monitoring.
Unexpected skin lesions that are sensitive to touch.,Basal Cell Carcinoma,Surgical excision if necessary; sunscreen use.
Recurring episodes of severe abdominal pain.,Gallstones,Ursodeoxycholic acid; surgical removal if symptomatic.
Difficulty swallowing and a sensation of a lump in the throat.,Esophageal Stricture,Proton pump inhibitors; dietary modifications.
Frequent intense headaches that impair daily activities.,Cluster Headaches,Verapamil as preventative; oxygen therapy during attacks.
Sudden episodes of confusion and difficulty remembering recent events.,Transient Ischemic Attack,Aspirin 81mg daily; neurology referral for further evaluation.
I've been experiencing headaches and dizziness.,Migraine and Vertigo,Pain relievers and vestibular rehabilitation therapy.
My stomach has been upset with diarrhea.,Irritable Bowel Syndrome,Dietary adjustments and anti-diarrheal medications.
Noticed a spreading rash on my arm.,Contact Dermatitis,Corticosteroid creams and avoiding irritants.
Persistent coughing and breath shortness.,Chronic Asthma,Inhaled corticosteroids and lifestyle modifications.
Sharp knee pain when walking.,Knee Osteoarthritis,Physical therapy and NSAIDs.
"Vision is blurry, especially when reading.",Age-related Macular Degeneration,Prescription reading glasses and regular eye exams.
"Feeling very tired, even with full sleep.",Chronic Fatigue Syndrome,Lifestyle adjustments and cognitive behavioral therapy.
Severe back pain after long sitting periods.,Sciatica,Physical therapy and pain relievers.
Frequent urination and excessive thirst.,Type 1 Diabetes,Insulin therapy and dietary planning.
Trouble sleeping and feeling anxious.,Insomnia and Generalized Anxiety Disorder,CBT and sleep hygiene practices.
Sudden weight loss without trying.,Hyperthyroidism,Thyroid hormone replacement therapy.
Constant feeling of being cold.,Hypothyroidism,Thyroid hormone replacement therapy.
Unexplained bruises appearing on the skin.,Leukemia,Chemotherapy or targeted drug therapy.
Persistent sore throat and fever.,Strep Throat,Antibiotics and throat lozenges.
Severe mood swings affecting daily life.,Bipolar Disorder,Mood stabilizers and psychotherapy.
Experiencing chest pain and tightness.,Angina,Nitroglycerin and lifestyle changes.
Unusual hair loss in patches.,Alopecia Areata,Steroid injections and topical immunotherapy.
Swelling and pain in the joints.,Rheumatoid Arthritis,DMARDs and NSAIDs.
Constant nausea and occasional vomiting.,Gastroenteritis,Rehydration and antiemetic medication.
Experiencing flashes of light in vision.,Retinal Detachment,Urgent surgical assessment.
Sudden and severe abdominal pain.,Appendicitis,Surgical removal of the appendix.
"Dry, itchy patches on the skin.",Eczema,Moisturizers and topical steroids.
Frequent and severe nosebleeds.,Epistaxis,Pinching the nose and leaning forward.
Difficulty swallowing and throat tightness.,Esophageal Stricture,Acid reducers and esophageal dilation.
Unintentional weight gain and facial puffiness.,Hypothyroidism,Thyroid hormone replacement therapy.
"High fever, headache, and stiff neck.",Meningitis,Antibiotics and corticosteroids.
Pain and burning sensation when urinating.,Urinary Tract Infection,Antibiotics and pain relief.
Severe itching and swelling after insect bites.,Severe Allergic Reaction,Antihistamines and corticosteroids.
Painful blisters on the lips or around the mouth.,Herpes Simplex,Antiviral medication and pain relief.
Blood in urine without pain.,Hematuria,Further diagnostic tests and treatment based on cause.
Cramps and bloating in the lower abdomen.,Irritable Bowel Syndrome,Dietary changes and antispasmodic medications.
White patches inside the mouth or on the tongue.,Oral Thrush,Antifungal medication.
Sudden severe headache with no known cause.,Subarachnoid Hemorrhage,Immediate medical evaluation and CT scan.
"Red, painful eye with blurred vision.",Uveitis,Steroid eye drops and dark glasses.
"Swollen, tender lymph nodes in the neck.",Lymphadenitis,Antibiotics and warm compresses.
Difficulty breathing after eating certain foods.,Food Allergy,Avoidance of allergens and emergency epinephrine.
Intense burning sensation and redness in the eye.,Conjunctivitis,Antibiotic or antihistamine eye drops.
Recurring episodes of fainting or dizziness.,Vasovagal Syncope,Stay hydrated; avoid triggers like standing for long.
Sudden onset of paralysis on one side of the face.,Bell's Palsy,Corticosteroids and physical therapy.
Excruciating pain around the lower back area.,Kidney Stones,Pain relievers and drinking water to pass the stone.
Noticeable change in bowel habits and blood in stool.,Colorectal Cancer,Surgical intervention and chemotherapy if needed.
Extreme fatigue and yellowing of the skin.,Hepatitis C,Antiviral treatment and liver health monitoring.
Severe pain in the chest that radiates to the left arm.,Myocardial Infarction,Emergency medical care; aspirin; and oxygen therapy.
Unexpected swelling and pain in one leg.,Deep Vein Thrombosis,Anticoagulants and wearing compression stockings.
Intense abdominal pain and bloating after meals.,Gallstones,Pain management and possibly surgery to remove gallstones.
Recurring severe headaches accompanied by nausea.,Migraine,Pain relief medication and avoiding migraine triggers.
Loss of appetite and metallic taste in the mouth.,Gastroesophageal Reflux Disease,Antacids and diet changes to manage symptoms.
Frequent memory lapses and confusion.,Alzheimer's Disease,Medication to slow disease progression and manage symptoms.
Uncontrollable shaking of hands.,Parkinson's Disease,Medication to control symptoms and physical therapy.
Sudden loss of vision in one eye.,Retinal Vein Occlusion,Urgent assessment by an ophthalmologist; possible laser treatment.
Chronic soreness and stiffness in the shoulder.,Frozen Shoulder,Physical therapy and pain relief medications.
Ringing in the ears that doesn't go away.,Tinnitus,Sound therapy and avoiding loud noises.
Recurring painful ulcers in the mouth.,Aphthous Ulcers,Mouth rinses and topical treatments.
Persistent itchiness and flaking of the scalp.,Seborrheic Dermatitis,Medicated shampoos and topical treatments.
Unexplained episodes of rapid heartbeat.,Paroxysmal Supraventricular Tachycardia,Medications to control heart rate and avoid triggers.
Continuous sneezing and watery eyes during spring.,Allergic Rhinitis,Antihistamines and avoiding allergens.
"Hard, dry stools and difficulty passing them.",Constipation,High-fiber diet and hydration.
Sharp chest pains and difficulty swallowing food.,Esophagitis,Acid reducers and eating smaller meals.
High blood pressure readings on multiple occasions.,Hypertension,Blood pressure medication and lifestyle changes.
Swelling and stiffness in the hands in the morning.,Rheumatoid Arthritis,DMARDs and anti-inflammatory medication.
Red and itchy patches of skin covered with silvery scales.,Psoriasis,Topical treatments and light therapy.
Intense fear and avoidance of social situations.,Social Anxiety Disorder,Cognitive-behavioral therapy and SSRIs.
Seeing double images in one line of vision.,Diplopia,Corrective lenses or surgery depending on cause.
"Frequent intense urges to urinate, even at night.",Overactive Bladder,Bladder training exercises and medication.
"Throbbing pain in the big toe, especially at night.",Gout,NSAIDs and lifestyle modifications.
Shortness of breath and wheezing after exercise.,Exercise-Induced Asthma,Inhaled bronchodilators before exercise.
Excessive snoring and feeling tired after a full night's sleep.,Sleep Apnea,Continuous positive airway pressure (CPAP) machine.
Burning sensation in the stomach and chest after eating.,Gastroesophageal Reflux Disease,Antacids and dietary changes.
Consistent pain and clicking noise in the jaw.,Temporomandibular Joint Disorder,Pain relievers and jaw exercises.
"Round, bald patches suddenly appearing on the scalp.",Alopecia Areata,Corticosteroid injections and topical immunotherapy.
"Sudden, severe pain in the lower right abdomen.",Appendicitis,Surgical removal of the appendix.
"Cracking, itchy, or red skin between the toes.",Athlete's Foot,Antifungal medication.
Experiencing a deep sense of sadness and loss of interest.,Major Depressive Disorder,Antidepressants and psychotherapy.
Persistent dry cough and a feeling of a lump in the throat.,Chronic Bronchitis,Cough suppressants and quitting smoking.
"Severe reaction to peanuts, including difficulty breathing.",Peanut Allergy,Epinephrine auto-injector and avoiding peanuts.
"Numbness and tingling in fingers, especially in cold weather.",Raynaud's Phenomenon,"Warming the affected areas, avoiding cold exposure."
Severe abdominal cramps and bloody diarrhea.,Ulcerative Colitis,"Anti-inflammatory drugs, corticosteroids."
"Painful, swollen joints in the morning that improve with activity.",Rheumatoid Arthritis,"DMARDs, NSAIDs, and lifestyle changes."
"Bluish skin color, especially on the lips and fingertips.",Cyanosis,"Oxygen therapy, addressing the underlying cause."
Fever with swollen lymph nodes and a rash across the cheeks.,Lupus,"Anti-inflammatories, antimalarials, and lifestyle adjustments."
"Severe, acute pain in the lower back, radiating to the groin.",Kidney Stones,"Pain management, hydration, and possibly shock wave therapy."
"Brownish patches on the skin, mostly on the face.",Melasma,"Sun protection, topical treatments, and in some cases, laser therapy."
Violent shaking and chills without any apparent reason.,Malaria,Antimalarial medication and supportive care.
"Brittle nails and hair loss, feeling cold all the time.",Hypothyroidism,Thyroid hormone replacement therapy.
Frequent muscle cramps and spasms in the legs.,Electrolyte Imbalance,Electrolyte replacement drinks and dietary changes.
"Difficulty focusing on close objects, needing more light to read.",Presbyopia,"Reading glasses or bifocals, proper lighting."
Unexpected and unexplained bruising on the body.,Hemophilia,Clotting factor replacement therapy.
A sudden increase in frequency and intensity of headaches.,Migraines,"Pain relief medication, avoiding triggers, and in some cases, preventive medication."
"Extremely dry, cracked skin that may bleed.",Eczema,"Moisturizers, topical corticosteroids, and avoiding irritants."
Constantly feeling thirsty and drinking large amounts of water.,Diabetes Insipidus,"Medication to reduce urine output, adequate hydration."
"Uncontrollable movements of the eyes, rapid side to side.",Nystagmus,"Eye patches or glasses, in some cases surgery."
A lump in the neck that can be felt from the outside.,Thyroid Nodule,"Regular monitoring, biopsy or surgery if malignant."
"Sudden, unexplained weight loss and night sweats.",Lymphoma,"Chemotherapy, radiation therapy, or stem cell transplantation."
"Difficulty maintaining balance, feeling dizzy when standing up.",Orthostatic Hypotension,"Increasing salt intake, wearing compression stockings."
Red streaks spreading from a cut or scratch.,Cellulitis,"Antibiotics, keeping the area clean and elevated."
"Severe reaction to bee stings, including swelling and difficulty breathing.",Anaphylaxis,"Emergency epinephrine, antihistamines."
Experiencing flashes of light and floaters in vision.,Retinal Detachment,"Urgent ophthalmologic evaluation, potential surgery."
Intolerable itching in the ears and throat.,Allergic Rhinitis,"Antihistamines, nasal corticosteroids."
Discomfort and pain in the chest after eating spicy foods.,Acid Reflux,"Antacids, avoid trigger foods, eat smaller meals."
"Persistent sadness, loss of interest in activities, and fatigue.",Depression,"Antidepressants, psychotherapy."
Sharp pains shooting down the leg from the lower back.,Sciatica,"Physical therapy, NSAIDs, sometimes surgery."
Irregular heartbeat and fainting spells.,Arrhythmia,"Electrolyte correction, potentially pacemaker or medication."
"White, painless patches inside the mouth.",Leukoplakia,"Regular monitoring, potentially surgical removal."
Frequent episodes of intense fear and palpitations without any apparent trigger.,Panic Attacks,"CBT, SSRIs, lifestyle modifications."
"Excessive sweating, even in cool temperatures or at rest.",Hyperhidrosis,"Antiperspirants, Botox injections for severe cases."
"Burning pain and stiffness in the Achilles tendon, especially in the morning.",Achilles Tendinitis,"Rest, ice, physical therapy, anti-inflammatory medication."
"Severe abdominal pain and tenderness, especially in the lower right side.",Appendicitis,Surgical removal of the appendix.
"Difficulty swallowing, feeling like food is stuck in the throat.",Esophageal Obstruction,"Dietary changes, endoscopic treatment."
"A chronic dry, hacking cough without any signs of infection.",Chronic Bronchitis,"Quitting smoking, bronchodilators."
Noticeable thinning of the hair on the top of the head.,Androgenetic Alopecia,"Minoxidil, finasteride for males."
"Greenish discharge from the eyes, accompanied by itching and irritation.",Conjunctivitis,Antibiotic or antihistamine eye drops.
"Experiencing confusion, difficulty speaking, and understanding speech.",Stroke,"Immediate medical attention, clot-busting drugs."
Constant feeling of fullness in the ears and hearing loss.,Eustachian Tube Dysfunction,"Nasal steroids, autoinflation exercises."
"Blood in stool, along with a change in bowel movement frequency.",Colorectal Cancer,"Colonoscopy, potentially surgery, chemotherapy."
